{
  "slug": "normod-konforu",
  "name": "Normod konforu",
  "title": "İyi hissettiren bir yer.",
  "description": "Otururken sırtını nasıl desteklediğin, ayaklarının yere değmesi ve uzanmayı sevdiğin yön, sana uygun koltuğu seçerken önemlidir. Tek bir doğru yerine kendi rahatlığını ara.",
  "sections": {
    "section-1": {
      "title": "Rahatlık kişiseldir.",
      "body": "Otururken sırtını nasıl desteklediğin, ayaklarının yere değmesi ve uzanmayı sevdiğin yön, sana uygun koltuğu seçerken önemlidir. Tek bir doğru yerine kendi rahatlığını ara."
    },
    "section-2": {
      "title": "Biraz zaman ayır.",
      "body": "Koltukta birkaç dakika otur. Farklı pozisyonları dene, yastıkları yerleştir. Oturum derinliğini ve yüksekliğini yalnızca ekranda değil, deneyimleyerek değerlendir."
    },
    "section-3": {
      "title": "Detayları birlikte keşfet.",
      "body": "Modellerin oturum yapısı ve ölçüleri farklı olabilir. Mağazamızda beğendiğin tasarımları karşılaştır ve ekibimize sorularını sor."
    }
  },
  "seo": {
    "title": "Normod konforu | Normod Kıbrıs",
    "description": "Otururken sırtını nasıl desteklediğin, ayaklarının yere değmesi ve uzanmayı sevdiğin yön, sana uygun koltuğu seçerken önemlidir. Tek bir doğru yerine kendi rahatlığını ara."
  }
}
